Title,Date,Author,Link
"Strategy Up 2,930% Since 2020 Bitcoin Bet as Saylor Stays Bullish","Jun 1, 2025 - 15:06",Tomiwabold Olajide,https://u.today/strategy-up-2930-since-2020-bitcoin-bet-as-saylor-stays-bullish
"$100,000 Bitcoin in Danger, Bollinger Bands Warn","Jun 1, 2025 - 14:14",Gamza Khanzadaev,https://u.today/100000-bitcoin-in-danger-bollinger-bands-warn
Bitcoin (BTC) Price Prediction for June 1,"Jun 1, 2025 - 14:05",Denys Serhiichuk,https://u.today/bitcoin-btc-price-prediction-for-june-1-0
"Bitcoin Price Just Made History, but What Happens Next?","Jun 1, 2025 - 12:19",Gamza Khanzadaev,https://u.today/bitcoin-price-just-made-history-but-what-happens-next
No More Bitcoin? Exchange Outflows Show Supply Shock Possibilities,"Jun 1, 2025 - 10:08",Arman Shirinyan,https://u.today/no-more-bitcoin-exchange-outflows-show-supply-shock-possibilities
Silk Road Founder Now Extremely Rich Because of Recent Bitcoin Donation,"Jun 1, 2025 - 9:37",Alex Dovbnya,https://u.today/silk-road-founder-now-extremely-rich-because-of-recent-bitcoin-donation
Ripple CEO: 'Bitcoin Community Is Not Our Enemy',"Jun 1, 2025 - 7:29",Alex Dovbnya,https://u.today/ripple-ceo-bitcoin-community-is-not-our-enemy
It Will Be Exponentially Harder to Buy Bitcoin: Michael Saylor,"May 31, 2025 - 20:00",Yuri Molchan,https://u.today/it-will-be-exponentially-harder-to-buy-bitcoin-michael-saylor
Sell Bitcoin or Hold? Sobering Economic Model by Investor Fred Krueger,"May 31, 2025 - 14:16",Vladislav Sopov,https://u.today/sell-bitcoin-or-hold-sobering-economic-model-by-investor-fred-krueger
Strategy's Major Bitcoin Accumulation Risks Revealed by Analysts,"May 31, 2025 - 9:33",Yuri Molchan,https://u.today/strategys-major-bitcoin-accumulation-risks-revealed-by-analysts
"Shiba Inu (SHIB) to Add Another Zero? Bitcoin (BTC) Signals New ATH Reversal Now, Ethereum (ETH) Trapped","May 31, 2025 - 0:01",Arman Shirinyan,https://u.today/shiba-inu-shib-to-add-another-zero-bitcoin-btc-signals-new-ath-reversal-now-ethereum-eth-trapped
Fidelity: Bitcoin Could Reach This 'Important Milestone',"May 30, 2025 - 19:52",Alex Dovbnya,https://u.today/fidelity-bitcoin-could-reach-this-important-milestone
JPMorgan CEO Says US Shouldn't Stockpile Bitcoin,"May 30, 2025 - 16:27",Alex Dovbnya,https://u.today/jpmorgan-ceo-says-us-shouldnt-stockpile-bitcoin
"XRP on Verge of 66% Crash Versus Bitcoin, Bollinger Bands Signal","May 30, 2025 - 15:58",Gamza Khanzadaev,https://u.today/xrp-on-verge-of-66-crash-versus-bitcoin-bollinger-bands-signal
$4 Billion Lost: Satoshi's Bitcoin Holdings Hit by Price Slump,"May 30, 2025 - 15:24",Tomiwabold Olajide,https://u.today/4-billion-lost-satoshis-bitcoin-holdings-hit-by-price-slump
VR Legend Palmer Luckey Says He Started Mining Bitcoin Early,"May 30, 2025 - 14:04",Alex Dovbnya,https://u.today/vr-legend-palmer-luckey-says-he-started-mining-bitcoin-early
"$684,680,203 Bitcoin Stuns Major US Exchange Kraken: Sell in May?","May 30, 2025 - 12:33",Gamza Khanzadaev,https://u.today/684680203-bitcoin-stuns-major-us-exchange-kraken-sell-in-may
"Next 2 Days, 16 Hours Crucial for Bitcoin; Here's Why","May 30, 2025 - 11:50",Tomiwabold Olajide,https://u.today/next-2-days-16-hours-crucial-for-bitcoin-heres-why
Bitcoin (BTC) Price Prediction for May 30,"May 30, 2025 - 10:44",Denys Serhiichuk,https://u.today/bitcoin-btc-price-prediction-for-may-30
"20,000+ Bitcoin Bought in Just Two Days – Whales Expecting New ATH?","May 30, 2025 - 10:40",Yuri Molchan,https://u.today/20000-bitcoin-bought-in-just-two-days-whales-expecting-new-ath
$4.26 Billion Pulled Into Bitcoin ETFs in 10 Consecutive Days,"May 29, 2025 - 22:15",Caroline Amosun,https://u.today/426-billion-pulled-into-bitcoin-etfs-in-10-consecutive-days
Bitcoin Index Shows Early Upside Signal: BTC Price Rally Next?,"May 29, 2025 - 21:20",Paul Adedoyin,https://u.today/bitcoin-index-shows-early-upside-signal-btc-price-rally-next
Scaramucci: Can Bitcoin Go to $500K?,"May 29, 2025 - 15:50",Alex Dovbnya,https://u.today/scaramucci-can-bitcoin-go-to-500k
Bitcoin Plunges to Weekly Low as FTX Set to Release $5 Billion,"May 29, 2025 - 15:34",Gamza Khanzadaev,https://u.today/bitcoin-plunges-to-weekly-low-as-ftx-set-to-release-5-billion
"Bitcoin (BTC) 21 Million Cap Ruins Network Security, Here's How","May 29, 2025 - 15:06",Vladislav Sopov,https://u.today/bitcoin-btc-21-million-cap-ruins-network-security-heres-how
"Bitcoin Hits New ATH, But It's Not Price: Up $25.8 Billion","May 29, 2025 - 13:01",Yuri Molchan,https://u.today/bitcoin-hits-new-ath-but-its-not-price-up-258-billion
Bitcoin (BTC) Becomes Canary in Coal Mine: Opinion,"May 29, 2025 - 11:32",Vladislav Sopov,https://u.today/bitcoin-btc-becomes-canary-in-coal-mine-opinion
Ethereum Decouples From Bitcoin as Key Metrics Turn Green,"May 29, 2025 - 9:58",Godfrey Benjamin,https://u.today/ethereum-decouples-from-bitcoin-as-key-metrics-turn-green
Bitcoin Might See $80 Billion in New Demand: Details,"May 29, 2025 - 8:36",Alex Dovbnya,https://u.today/bitcoin-might-see-80-billion-in-new-demand-details
Schiff Says He's Responsible for People Buying Bitcoin,"May 29, 2025 - 7:12",Alex Dovbnya,https://u.today/schiff-says-hes-responsible-for-people-buying-bitcoin
"Bitcoin Being Tested Right Now, Ethereum (ETH) Breaks out Against BTC, XRP: One Last Chance at $2","May 29, 2025 - 0:01",Arman Shirinyan,https://u.today/bitcoin-being-tested-right-now-ethereum-eth-breaks-out-against-btc-xrp-one-last-chance-at-2
More Strategy's Bitcoin Holdings Identified by Arkham: Details,"May 28, 2025 - 20:59",Paul Adedoyin,https://u.today/more-strategys-bitcoin-holdings-identified-by-arkham-details
'Most Corrupt Bill Ever': Peter Schiff Slams Fed-Backed Bitcoin Plan,"May 28, 2025 - 20:16",Caroline Amosun,https://u.today/most-corrupt-bill-ever-peter-schiff-slams-fed-backed-bitcoin-plan
"Ripple CTO Ends Speculation on XRP Centralization, $878,917,974 Bitcoin Stun Coinbase, Ethereum Eyes $3,000, But One Thing Remains: Crypto News Digest by U.Today","May 28, 2025 - 16:27",Valeria Blokhina,https://u.today/ripple-cto-ends-speculation-on-xrp-centralization-878917974-bitcoin-stun-coinbase-ethereum-eyes
Breaking: Bitcoin and XRP in 401(k)s? Labor Dept. Scraps Anti-Crypto Guidance,"May 28, 2025 - 13:30",Alex Dovbnya,https://u.today/breaking-bitcoin-and-xrp-in-401ks-labor-dept-scraps-anti-crypto-guidance
Pompliano Unveils What Big Bitcoin Bet by GameStop Really Means,"May 28, 2025 - 13:23",Gamza Khanzadaev,https://u.today/pompliano-unveils-what-big-bitcoin-bet-by-gamestop-really-means
"'Bitcoin Is The Way,' Expert Tom Lee Says, Expecting Massive Price Surge","May 28, 2025 - 10:21",Yuri Molchan,https://u.today/bitcoin-is-the-way-expert-tom-lee-says-expecting-massive-price-surge
'Rich Dad Poor Dad' Author Predicts Bitcoin to $1 Million Amid Coming Economic Crash,"May 28, 2025 - 8:19",Yuri Molchan,https://u.today/rich-dad-poor-dad-author-predicts-bitcoin-to-1-million-amid-coming-economy-crash
BlackRock Reveals Ideal Bitcoin Allocation,"May 28, 2025 - 7:10",Alex Dovbnya,https://u.today/blackrock-reveals-ideal-bitcoin-allocation
Top Trader Reveals Bitcoin Price Target for June,"May 27, 2025 - 20:18",Alex Dovbnya,https://u.today/top-trader-reveals-bitcoin-price-target-for-june
$150 Million Bitcoin Transfer Stuns Major US Exchange,"May 27, 2025 - 19:57",Caroline Amosun,https://u.today/150-million-bitcoin-mysterious-transfer-stuns-major-us-exchange
"142,709,679,640 SHIB Left Coinbase Prime, Cardano ETF Deadline This Week, Strategy's $40 Billion Bitcoin Bet Just Got Bigger: Crypto News Digest by U.Today","May 27, 2025 - 16:06",Valeria Blokhina,https://u.today/142709679640-shib-left-coinbase-prime-cardano-etf-deadline-this-week-strategys-40-billion-bitcoin
Bitcoin (BTC) Price Prediction for May 27,"May 27, 2025 - 15:54",Denys Serhiichuk,https://u.today/bitcoin-btc-price-prediction-for-may-27
"Bitcoin Market Warning Issued as Speculation Peaks, What's Next for BTC?","May 27, 2025 - 15:15",Tomiwabold Olajide,https://u.today/bitcoin-market-warning-issued-as-speculation-peaks-whats-next-for-btc
"Bitcoin for Gold, Bloomberg's Mike McGlone Teases Potential Twist Ahead","May 27, 2025 - 15:12",Godfrey Benjamin,https://u.today/bitcoin-for-gold-bloombergs-mike-mcglone-teases-potential-twist-ahead
Strategy's Michael Saylor Asks Crucial Bitcoin Question,"May 27, 2025 - 14:56",Gamza Khanzadaev,https://u.today/strategys-michael-saylor-asks-crucial-bitcoin-question
"$10 Million per Bitcoin? Not Just Now, Samson Mow Explains Why","May 27, 2025 - 11:10",Yuri Molchan,https://u.today/10-million-per-bitcoin-not-just-now-samson-mow-explains-why
"Bitcoin (BTC): $115,000 Next? 7,000,000,000 Pepe (PEPE) Long Is Born, Dogecoin (DOGE) Short-Term Rally Incoming?","May 27, 2025 - 0:01",Arman Shirinyan,https://u.today/bitcoin-btc-115000-next-7000000000-pepe-pepe-long-is-born-dogecoin-doge-short-term-rally-incoming
"$32,917,434,000 Bitcoin Added by Long-Term Holders: $200K BTC In 2025?","May 26, 2025 - 20:33",Paul Adedoyin,https://u.today/32917434000-bitcoin-added-by-long-term-holders-200k-btc-in-2025
Satoshi's Bitcoin Fortune Surges to $120 Billion,"May 26, 2025 - 18:35",Alex Dovbnya,https://u.today/satoshis-bitcoin-fortune-surges-to-120-billion
Zircuit Enables Non-Custodial Wallet Top-Ups for Crypto.com Visa Cards,No Date,Unknown,https://u.today/press-releases/zircuit-enables-non-custodial-wallet-top-ups-for-cryptocom-visa-cards
"Kyrgyz Republic to Launch USDKG, a Gold-Backed Stablecoin Pegged to the U.S. Dollar, in Q3 2025",No Date,Unknown,https://u.today/press-releases/kyrgyz-republic-to-launch-usdkg-a-gold-backed-stablecoin-pegged-to-the-us-dollar-in
"15th Anniversary Blockchain Life Forum to Take Place in Dubai, October 28-29, 2025 – Unprecedented Scale",No Date,Unknown,https://u.today/press-releases/15th-anniversary-blockchain-life-forum-to-take-place-in-dubai-october-28-29-2025
Ethereum's Pectra: Big Guide,"May 26, 2025 - 16:27",Vladislav Sopov,https://u.today/guides/ethereums-pectra-big-guide
How to Buy Ethereum: Step-by-Step Guide,"May 5, 2025 - 7:56",Vladislav Sopov,https://u.today/guides/how-to-buy-ethereum-steb-by-step-guide
Crypto App Triv Ensures Secure Web3 Journey With Triv Shield Instrument: Review,"May 2, 2025 - 18:50",Vladislav Sopov,https://u.today/reviews/crypto-app-triv-ensures-secure-web3-journey-with-triv-shield-instrument-review
Gate.io Top Crypto Exchange Makes Digital Assets Accessible: Review,"Apr 16, 2025 - 12:35",Vladislav Sopov,https://u.today/reviews/gateio-top-crypto-exchange-makes-digital-assets-accessible-review
Top Crypto Exchanges 2025: Full Guide,"Apr 1, 2025 - 12:25",Vladislav Sopov,https://u.today/guides/top-crypto-exchanges-2025-full-guide
